SD: Rabbit MQ vs. Kafka 	Rabbit:<br>- can’t rewind<br>- push to consumers<br>- no batching<br>- better for single messages<br>- worse for scale<br>- different topology
Prob: Games WL-algorithm	isWinning(x):<br><br>true if any reachable pos x is !isWinning(x)<br><br>else false
Prob: game of Nim (def, win)	several piles, can take any number from one pile<br><br>lose if empty<br><br>winning pos if <b>XOR</b> of pile size is != 0
Graph: longest path from vertex in weighted graph<br>+ DAG	NP-hard for general graph<br>naive Bruteforce E!<br><br>linear for DAG: toposort, then loop<br>O(V + E)
Array: subarray sum (max, shortest >= k, max no more than k)	- max: Kadane O(n)<br><br>- sliding window O(n) or monotonic stack<br><br>- max <= k: O(n log n) using <b>BST upper_bound</b>
Prob: submatrix problems:<br>largest square/cross, static RSQ, max rectangle sum	- largest square/cross: <b>pre-compute</b><br><br>- static RSQ: precompute<br><br>- max rectangle sum: <b>reduce</b> to n^2 * <b>1D Kadane</b> O(n)
Prob: reflex D<br>1. find max less than k (min/more)<br>2. Graph all paths<br>3. count s.t. = K	1. <b>BST</b> with upper/lower_bound<br>2. BF backtracking if possible, maybe TSP DP<br>3. count <= K - <= K - 1
DS: Fenwick tree (=Binary Index Tree)	store <b>cumulative sum/prefix sums</b><br><br>easier to code than SegmentTree<br><br>update: log(n)<br>compute: log(n)<br>build: O(n log n)?
Geo: horizontal/vertical line intersections	3 events: start/end of horiz, vertical<br><br>keep set of <b>active horiz lines</b> in <b>BST</b><br><br>for a vertical: <b>range search</b> in BST to find intersections
DS: Segment Tree	binary tree built on <b>top of integer array</b><br><br>solve the <b>dynamic Range Min/Max/Sum Query</b> with <b>Range Update Query</b><br><br>all in <b>O(log N)</b><br><br><b>3</b> types of trees: RMinQ/RMaxQ/RSumQ<br><br>built in O(n)
DS: Binary Indexed Tree (BIT, Fenwick)	from a <b>prefix sum table</b><br><b>dynamic query</b> and <b>update</b><br><br>Variants: with Point or Range query, with Point or Range update<br><br>Build: O(n), Queries: O(log n)
DS: Difference between Interval/Segment/Binary Index Tree	- Interval: from intervals, dynamic, find intersection with query interval<br><br>- Segment Tree: from int array, solve dynamic Range Min/Max/Sum with Range Update<br><br>- Binary Indexed Tree (=Fenwick): for array, solve dynamic Range Sum only, but simpler than Segment Tree
String: <b>Longest Repeated</b> Substring and <b>Longest Common</b> Substring (LCS) with <b>Suffix Tree</b>	- repeated: <b>deepest non-leaf</b> node of ST<br>O(n)<br><br>- common: build ST with 1 <b>terminal symbol</b> for <b>each</b> string<br>find <b>deepest non-leaf</b> with <b>both</b> ends in subtree<br>O(n)
SD primitives: 2 rate limiters (with 1 def)	- <b>leaky bucket</b>: <b>2</b> parameters (burst size=bucket size, rate)<br>><b>increment</b> counter when new request<br><b>decrement</b> counter at given rate<br>reject request if bucket full<br><br>- token bucket
SD: network addressing methods (routing schemes) (5)	<b>unicast</b><br><br><b>broadcast</b>: one-to-all, subnet generally<br><br><b>multicast</b>: like broadcast but subset<br><br><b>anycast</b>: to one of many with same IP address (closest), used by CDN<br><br><b>geocast</b>
Prob: stable matching problem (def, solution idea, complex)	= <b>stable marriage</b>problem<br><br>n men, n women<br>every one has <b>order of preference</b> over partners<br>marry such that there is not (1 man, 1 woman) who would rather be together<br><br>solution: <b>rounds</b> with <b>proposals/switches (deferred acceptance)</b> O(n^2)
Prob: assignment problem (def, solution, complex)	<b>maximum-weight matching</b> in weighted <b>bipartite</b> graph<br><br>matchs n agents and n tasks<br>can do any tasks but with diff cost<br><br>O(n^3) Hungarian algo on matrix
String: Z-algorithm (idea, complexity)	Z: <b>array</b> of length n<br>Z[i]: longest common prefix between S[0:] and S[i:]<br><br>can be computed in O(n)<br><br>can be used for pattern matching (O(n) P$S)
Graph: Detect cycle in a graph<br>(dir/undir, complex) (2)	1. <b>Colorized DFS</b> (directed or not): look for <b>back-edge</b><br>undirected: <b>ignore edge to parent</b><br>O(V + E).<br><br>2. <b>Undirected only</b>: <b>Union-Find</b>:<br><b>loop on edges</b>, UF on vertices O(E + V)
Graph: number of paths of length k, APSP of length k	- nb paths: <b>power</b> of <b>adjacency</b> matrix: <b>G^k</b><br><br>O(k n^3)<br><br>O(log k  n^3) with binary exponentiation<br><br>- APSP(k): G^k but with <b>min</b> operator<br>O(n^3 log k)
SD: Dedup system by UID	UID-<b>partitioned</b> workers with local <b>KV store</b> (RocksDB)<br>Fast membership test with LSM DBs (in-mem Bloom)<br><br>Keep UIDs in a time window, <b>expire</b> others:<br>use DB TTL; or <b>secondary index</b> with seqno/ts in <b>column family</b>: <b>sorted iterate</b> to expire<br>worker reads output topic after crash to rebuild state
SD: Primary vs. Secondary index	- Primary:  on a key with <b>unique values</b><br>controls <b>sorted storage layout</b> of rows. Multiple columns?<br><br>- Secondary: can be on <b>key with duplicates</b><br>no effect on order
DS: complexity analysis (4)	- <b>flatten loops</b> for global count<br><br>- Memoized: NbDiffSubProblems * TimePerSubProblem<br><br>- Recursion with formula<br><br>- Amortization
SD: foreign key	field (or several) in one table that <b>uniquely</b> identifies a <b>row</b> of <b>another table</b> (<b>primary</b> or unique key of that table)
SD: CAP (C, A def)	C: every read receives most recent write or error<br><br><br>A: every request receives non-error result with no guarantees that it is most recent write
Prob: Compress jumps along a segment / Painting subarrays offline	use <b>Union-Find</b><br><br>paint:<br>take [l,r],color painting requests in <b>reverse order</B><br><br>store <b>nextUnpainted >= i</b> and use U-F to quickly <b>skip over</b> painted sections
DS: Union-Find optimizations (1, 3)	- <b>path compression</b>: <b>set parent</b> when doing a <b>find</b><br><br>- <b>union</b> (3):<br>a. union by <b>size</b><br>b. union by <b>depth</b><br>c. <b>randomized union</b> (simpler, same complexity)
SD: Cassandra: coordinator	one <b>normal</b> node, can <b>change</b> at any request<br><br>in charge of the <b>whole request</b>:<br>- consistent hash to <b>find nodes</b> to query<br><b>respond to client</b> according to config consistency level 
SD: Cassandra: partitioning, replication, consistency	<b>Consistent hashing</b><br><br>Replication factor: <b>copy</b> to <b>RF</b> machines = neighbors in hash ring<br><br>Consistency read/write levels:<br><br>min numbers of nodes reached by a query<br><br>(One, Quorum=1+RF/2, All)
Array: count smaller elements on the right side (3)	- augmented BST with size field<br>O(n log n)<br><br>- Fenwick/Binary Index Tree<br>O(n log n)<br><br>- -> <b>D&C mergesort-based</b><br>avg O(n log n)
Array: count smaller elements on the right side with <b>D&C</b>	<b>mergesort</b>-based<br><br><br><b>recursively solve</b> for left, right halves (and sort subarrays)<br><br>add count of <b>left/right pairs</b> by <b>sorted-merge step</b><br>O(n log n)
Array: count pairs (x, y) with y in [x + a, x + b] (y to the left of x)	like <b>count smaller elements on the right side</b><br><br><b>D&C mergesort-like</b> O(n log n)<br><br><br>also: BST with size, BIT maybe
Prob: Increment(key), Decrement(key), GetMaxKey(), GetMinKey() all in O(1)	1 <b>Doubly Linked-List</b> for <b>each counter</b> value<br><br>+ <b>HashMap</b> to <b>look up</b> a <b>DLL node</b> by its <b>key</b>
Array: shortest distance pair (x, y) such that y >= x + k (2)	- from <b>right to left</b> with <b>increasing stack</b><br><br>- from <b>left to right</b> with <b>increasing dequeue</b>
String: hashing algo	p = 31, m = 9 + 10^9<br><br>Sum s_i p^i mod m<br><br>p: prime greater than alphabet<br><br>don't map a to 0 (a, aa collide)
Prob: C++ API for custom sort	sort(A.begin(), A.end(), greater<int>())<br><br>bool compare(int x, int j) { return x < y; }<br>sort(., ., compare)
Prob: C++ API for custom Priority Queue	priority_queue<int, <b>vector<int></b>, greater<int>>> Q<br><br>with lambda:<br>auto cmp = [](int left, int right) { return left < right; };<br>priority_queue<int, std::vector<int>, decltype(cmp)> Q(cmp);
Prob: C++ API for custom set/map	like priority queue<br>use builtin (greater)<int><br>or custom lambda<br><br>map<T, <b>T</b>, comp> not map<T, vector<T>, comp>